{
  "schema_version": "1.0.0",
  "case_event_id": "cev_02918a2b3c4d5e6f7a8b9c0d",
  "case_id": "case_01918a2b3c4d5e6f7a8b9c0d",
  "policy_id": "pol_a1b2c3d4e5f60718",
  "from_state": "CREATED",
  "to_state": "TRIAGED",
  "occurred_at": "2026-09-01T08:05:00Z",
  "payload": {
    "triage_category": "GRACE_PERIOD_ESCALATION",
    "initial_priority": "HIGH"
  }
}

