{
  "schema_version": "1.0.0",
  "case_event_id": "cev_07918a2b3c4d5e6f7a8b9c0d",
  "case_id": "case_01918a2b3c4d5e6f7a8b9c0d",
  "policy_id": "pol_a1b2c3d4e5f60718",
  "from_state": "EXECUTED",
  "to_state": "RESOLVED",
  "occurred_at": "2026-09-02T14:00:00Z",
  "payload": {
    "resolution_disposition": "PREMIUM_PAID_POLICY_RETAINED",
    "payment_confirmation_id": "pay_9876543210ab"
  }
}

