{
  "schema_version": "1.0.0",
  "case_event_id": "cev_05918a2b3c4d5e6f7a8b9c0d",
  "case_id": "case_01918a2b3c4d5e6f7a8b9c0d",
  "policy_id": "pol_a1b2c3d4e5f60718",
  "from_state": "RECOMMENDED",
  "to_state": "HUMAN_REVIEWED",
  "occurred_at": "2026-09-01T09:30:00Z",
  "payload": {
    "human_review": {
      "reviewer_id": "usr_spec_8192",
      "reviewed_at": "2026-09-01T09:30:00Z",
      "decision": "APPROVED",
      "rationale_code": "APPROVED_STANDARD_CONSULTATION",
      "justification": "Policyholder is in active grace period with high retention probability upon consultation."
    }
  }
}

