{
  "schema_version": "1.0.0",
  "case_event_id": "cev_01918a2b3c4d5e6f7a8b9c0d",
  "case_id": "case_01918a2b3c4d5e6f7a8b9c0d",
  "policy_id": "pol_a1b2c3d4e5f60718",
  "from_state": "NONE",
  "to_state": "CREATED",
  "occurred_at": "2026-09-01T08:00:00Z",
  "payload": {
    "trigger_reason": "SCHEDULED_PORTFOLIO_TRIAGE",
    "observation_as_of": "2026-09-01T00:00:00Z"
  }
}

